{
  "version": "0.3",
  "challengeId": "6f1b9c36-4c3b-4e0b-8a78-83fd8c12c710",
  "expiresAt": "2026-01-09T00:01:00Z",
  "requirements": {
    "pohp": {
      "minLevel": "AAIF-PoHP-3",
      "maxCredentialAgeSeconds": 120
    },
    "identity": {
      "mode": "required",
      "schemes": [
        "entra_oidc"
      ],
      "policy": {
        "allowedTenants": [
          "11111111-1111-1111-1111-111111111111"
        ],
        "requireMfa": true,
        "requireEmbeddedEvidence": true,
        "maxIdAgeSeconds": 600
      }
    }
  },
  "actionIntent": {
    "version": "0.3",
    "profile": "aaif.happ.profile.payment.transfer/v0.3",
    "intentId": "550e8400-e29b-41d4-a716-446655440000",
    "issuedAt": "2026-01-09T00:00:00Z",
    "audience": {
      "id": "did:web:bank.example",
      "name": "Example Bank"
    },
    "agent": {
      "id": "did:web:agent.example",
      "name": "Treasury Agent",
      "software": {
        "name": "ExampleAgent",
        "version": "1.0.0"
      }
    },
    "action": {
      "type": "payment.transfer",
      "parameters": {
        "amount": {
          "currency": "GBP",
          "value": "250.00"
        },
        "to": {
          "iban": "GB00EXAMP1E00000000000000",
          "name": "Example Supplier Ltd"
        },
        "reference": "Invoice 18372"
      }
    },
    "constraints": {
      "expiresAt": "2026-01-09T00:02:00Z",
      "oneTime": true,
      "envelope": {
        "amountRange": {
          "currency": "GBP",
          "min": "200.00",
          "max": "300.00"
        },
        "allowedPayees": [
          {
            "iban": "GB00EXAMP1E00000000000000"
          }
        ]
      }
    },
    "display": {
      "language": "en",
      "title": "Approve payment transfer",
      "summary": "Approve a £250.00 transfer to Example Supplier Ltd (Invoice 18372).",
      "riskNotice": "This action moves money and may be irreversible."
    }
  }
}
